{
  "$schema": "https://json-schema.org/draft/2020-12/schema",
  "$id": "https://wazir.dev/schemas/review.schema.json",
  "title": "Review Artifact",
  "type": "object",
  "required": ["phase", "role", "run_id", "created_at", "sources", "status", "loop_number", "findings"],
  "properties": {
    "phase": { "const": "review" },
    "role": { "const": "reviewer" },
    "run_id": { "type": "string", "minLength": 1 },
    "created_at": { "type": "string", "format": "date-time" },
    "sources": { "type": "array", "items": { "type": "string" } },
    "status": { "type": "string", "minLength": 1 },
    "loop_number": { "type": "integer", "minimum": 0 },
    "findings": {
      "type": "array",
      "items": {
        "type": "object",
        "required": ["severity", "title"],
        "properties": {
          "severity": { "type": "string", "minLength": 1 },
          "title": { "type": "string", "minLength": 1 }
        },
        "additionalProperties": true
      }
    }
  },
  "additionalProperties": true
}
