{
  "phase": "review",
  "role": "reviewer",
  "run_id": "run-2026-03-11-example",
  "created_at": "2026-03-11T12:45:00Z",
  "sources": [
    "artifacts/run-2026-03-11/verification-proof.json"
  ],
  "status": "complete",
  "loop_number": 1,
  "findings": [
    {
      "severity": "medium",
      "title": "Generated host exports must be regenerated after manifest changes."
    }
  ]
}
